id,submitter,authors,title,comments,journal-ref,doi,report-no,categories,license,abstract,versions,update_date,authors_parsed
1903.03157,Daniel Huber,"Maria Bergemann, Daniel Huber, Vardan Adibekyan, George Angelou,
  Daniela Barr\'ia, Timothy C. Beers, Paul G. Beck, Earl P. Bellinger, Joachim
  M. Bestenlehner, Bertram Bitsch, Adam Burgasser, Derek Buzasi, Santi Cassisi,
  M\'arcio Catelan, Ana Escorza, Scott W. Fleming, Boris T. G\""ansicke, Davide
  Gandolfi, Rafael A. Garc\'ia, Mark Gieles, Amanda Karakas, Yveline Lebreton,
  Nicolas Lodieu, Carl Melis, Thibault Merle, Szabolcs M\'esz\'aros, Andrea
  Miglio, Karan Molaverdikhani, Richard Monier, Thierry Morel, Hilding R.
  Neilson, Mahmoudreza Oshagh, Jan Rybizki, Aldo Serenelli, Rodolfo Smiljanic,
  Gyula M. Szab\'o, Silvia Toonen, Pier-Emmanuel Tremblay, Marica Valentini,
  Sophie Van Eck, Konstanze Zwintz, Amelia Bayo, Jan Cami, Luca Casagrande,
  Maksim Gabdeev, Patrick Gaulme, Guillaume Guiglion, Gerald Handler, Lynne
  Hillenbrand, Mutlu Yildiz, Mark Marley, Benoit Mosser, Adrian M.
  Price-Whelan, Andrej Prsa, Juan V. Hern\'andez Santisteban, Victor Silva
  Aguirre, Jennifer Sobeck, Dennis Stello, Robert Szabo, Maria Tsantaki, Eva
  Villaver, Nicholas J. Wright, Siyi Xu, Huawei Zhang, Borja Anguiano, Megan
  Bedell, Bill Chaplin, Remo Collet, Devika Kamath, Sarah Martell, S\'ergio G.
  Sousa, Yuan-Sen Ting, Kim Venn","Stellar Astrophysics and Exoplanet Science with the Maunakea
  Spectroscopic Explorer (MSE)","31 pages, 11 figures; To appear as a chapter for the Detailed Science
  Case of the Maunakea Spectroscopic Explorer",,,,astro-ph.SR astro-ph.EP,http://arxiv.org/licenses/nonexclusive-distrib/1.0/,"  The Maunakea Spectroscopic Explorer (MSE) is a planned 11.25-m aperture
facility with a 1.5 square degree field of view that will be fully dedicated to
multi-object spectroscopy. A rebirth of the 3.6m Canada-France-Hawaii Telescope
on Maunakea, MSE will use 4332 fibers operating at three different resolving
powers (R ~ 2500, 6000, 40000) across a wavelength range of 0.36-1.8mum, with
dynamical fiber positioning that allows fibers to match the exposure times of
individual objects. MSE will enable spectroscopic surveys with unprecedented
scale and sensitivity by collecting millions of spectra per year down to
limiting magnitudes of g ~ 20-24 mag, with a nominal velocity precision of ~100
m/s in high-resolution mode. This white paper describes science cases for
stellar astrophysics and exoplanet science using MSE, including the discovery
and atmospheric characterization of exoplanets and substellar objects, stellar
physics with star clusters, asteroseismology of solar-like oscillators and
opacity-driven pulsators, studies of stellar rotation, activity, and
multiplicity, as well as the chemical characterization of AGB and extremely
metal-poor stars.
","[{'version': 'v1', 'created': 'Thu, 7 Mar 2019 20:03:59 GMT'}]",2019-03-11,"[['Bergemann', 'Maria', ''], ['Huber', 'Daniel', ''], ['Adibekyan', 'Vardan', ''], ['Angelou', 'George', ''], ['Barría', 'Daniela', ''], ['Beers', 'Timothy C.', ''], ['Beck', 'Paul G.', ''], ['Bellinger', 'Earl P.', ''], ['Bestenlehner', 'Joachim M.', ''], ['Bitsch', 'Bertram', ''], ['Burgasser', 'Adam', ''], ['Buzasi', 'Derek', ''], ['Cassisi', 'Santi', ''], ['Catelan', 'Márcio', ''], ['Escorza', 'Ana', ''], ['Fleming', 'Scott W.', ''], ['Gänsicke', 'Boris T.', ''], ['Gandolfi', 'Davide', ''], ['García', 'Rafael A.', ''], ['Gieles', 'Mark', ''], ['Karakas', 'Amanda', ''], ['Lebreton', 'Yveline', ''], ['Lodieu', 'Nicolas', ''], ['Melis', 'Carl', ''], ['Merle', 'Thibault', ''], ['Mészáros', 'Szabolcs', ''], ['Miglio', 'Andrea', ''], ['Molaverdikhani', 'Karan', ''], ['Monier', 'Richard', ''], ['Morel', 'Thierry', ''], ['Neilson', 'Hilding R.', ''], ['Oshagh', 'Mahmoudreza', ''], ['Rybizki', 'Jan', ''], ['Serenelli', 'Aldo', ''], ['Smiljanic', 'Rodolfo', ''], ['Szabó', 'Gyula M.', ''], ['Toonen', 'Silvia', ''], ['Tremblay', 'Pier-Emmanuel', ''], ['Valentini', 'Marica', ''], ['Van Eck', 'Sophie', ''], ['Zwintz', 'Konstanze', ''], ['Bayo', 'Amelia', ''], ['Cami', 'Jan', ''], ['Casagrande', 'Luca', ''], ['Gabdeev', 'Maksim', ''], ['Gaulme', 'Patrick', ''], ['Guiglion', 'Guillaume', ''], ['Handler', 'Gerald', ''], ['Hillenbrand', 'Lynne', ''], ['Yildiz', 'Mutlu', ''], ['Marley', 'Mark', ''], ['Mosser', 'Benoit', ''], ['Price-Whelan', 'Adrian M.', ''], ['Prsa', 'Andrej', ''], ['Santisteban', 'Juan V. Hernández', ''], ['Aguirre', 'Victor Silva', ''], ['Sobeck', 'Jennifer', ''], ['Stello', 'Dennis', ''], ['Szabo', 'Robert', ''], ['Tsantaki', 'Maria', ''], ['Villaver', 'Eva', ''], ['Wright', 'Nicholas J.', ''], ['Xu', 'Siyi', ''], ['Zhang', 'Huawei', ''], ['Anguiano', 'Borja', ''], ['Bedell', 'Megan', ''], ['Chaplin', 'Bill', ''], ['Collet', 'Remo', ''], ['Kamath', 'Devika', ''], ['Martell', 'Sarah', ''], ['Sousa', 'Sérgio G.', ''], ['Ting', 'Yuan-Sen', ''], ['Venn', 'Kim', '']]"
1903.09430,Kathryn Stanonik Kreckel,"Kathryn Kreckel, Danielle Berg, Guillermo A. Blanc, I-Ting Ho, Bethan
  James, Antonios Katsianis, Juna A. Kollmeier, Mark Krumholz, David R. Law,
  Laurie Rousseau-Nepton, Karin Sandstrom, Evan Skillman, Yuan-Sen Ting, Renbin
  Yan, Dennis Zaritsky",Mapping Gas Phase Abundances and Enrichment Patterns Across Galaxy Disks,Submitted to the Astro2020 call for science white papers,,,,astro-ph.GA,http://arxiv.org/licenses/nonexclusive-distrib/1.0/,"  The distribution of gas-phase abundances in galaxy disks encodes the history
of nucleosynthesis and transport through the interstellar medium (ISM) over
cosmic time. Multi-object and high resolution integral-field spectroscopy have
started to measure these distributions across hundreds of HII regions
individually resolved at $\lesssim 100$ pc scales in a handful of objects, but
in the coming decade these studies will expand to larger samples of galaxies.
This will allow us to understand the role of feedback and turbulence in driving
the mixing and diffusion of metals in the ISM, and statistically assess the
role of galaxy environment and disk dynamics in modifying how mixing proceeds.
Detailed searches for over- and under-enriched regions can address to what
extent star formation is triggered by previous generations of star formation
and by pristine and recycled gas flows. Local galaxies, for which these
detailed measurements will be possible within the next decade, will inform the
interpretation of integrated measurements at high-z, where very different
dynamical gas-rich environments are found in early disk galaxies. Currently,
progress in the field is severely hampered by the 0.2-0.3 dex level systematic
uncertainties plaguing nebular abundance diagnostics. Improving our detailed
understanding of ionized nebulae at $<$20 pc scales will help us find a
solution to this problem, which will prove key to the study of metal enrichment
and mixing across the galaxy population in the next decade.
","[{'version': 'v1', 'created': 'Fri, 22 Mar 2019 10:17:33 GMT'}]",2019-03-25,"[['Kreckel', 'Kathryn', ''], ['Berg', 'Danielle', ''], ['Blanc', 'Guillermo A.', ''], ['Ho', 'I-Ting', ''], ['James', 'Bethan', ''], ['Katsianis', 'Antonios', ''], ['Kollmeier', 'Juna A.', ''], ['Krumholz', 'Mark', ''], ['Law', 'David R.', ''], ['Rousseau-Nepton', 'Laurie', ''], ['Sandstrom', 'Karin', ''], ['Skillman', 'Evan', ''], ['Ting', 'Yuan-Sen', ''], ['Yan', 'Renbin', ''], ['Zaritsky', 'Dennis', '']]"
1904.01074,Karoline Gilbert,"Karoline M. Gilbert, Erik J. Tollerud, Jay Anderson, Rachael L.
  Beaton, Eric F. Bell, Alyson Brooks, Thomas M. Brown, James Bullock, Jeffrey
  L. Carlin, Michelle Collins, Andrew Cooper, Denija Crnojevic, Julianne
  Dalcanton, Andres del Pino, Richard D'Souza, Ivanna Escala, Mark Fardal,
  Andreea Font, Marla Geha, Puragra Guhathakurta, Evan Kirby, Geraint F. Lewis,
  Jennifer L. Marshall, Nicolas F. Martin, Kristen McQuinn, Antonela Monachesi,
  Ekta Patel, Molly S. Peeples, Annalisa Pillepich, Amanda C. N. Quirk, R.
  Michael Rich, S. Tony Sohn, Yuan-Sen Ting, Roeland P. van der Marel, Andrew
  Wetzel, Benjamin F. Williams, Jennifer Wojno","Astro2020 Science White Paper: Construction of an L* Galaxy: the
  Transformative Power of Wide Fields for Revealing the Past, Present and
  Future of the Great Andromeda System",Submitted as a science white paper to the Astro2020 Decadal Survey,,,,astro-ph.GA,http://arxiv.org/licenses/nonexclusive-distrib/1.0/,"  The Great Andromeda Galaxy (M31) is the nexus of the near-far galaxy
evolution connection and a principal data point for near-field cosmology. Due
to its proximity (780 kpc), M31 can be resolved into individual stars like the
Milky Way (MW). Unlike the MW, we have the advantage of a global view of M31,
enabling M31 to be observed with techniques that also apply to more distant
galaxies. Moreover, recent evidence suggests that M31 may have survived a major
merger within the last several Gyr, shaping the morphology of its stellar halo
and triggering a starburst, while leaving the stellar disk largely intact. The
MW and M31 thus provide complementary opportunities for in-depth studies of the
disks, halos, and satellites of L* galaxies.
  Our understanding of the M31 system will be transformed in the 2020s if they
include wide field facilities for both photometry (HST-like sensitivity and
resolution) and spectroscopy (10-m class telescope, >1 sq. deg. field, highly
multiplexed, R~ 3000 to 6000). We focus here on the power of these facilities
to constrain the past, present, and future merger history of M31, via
chemo-dynamical analyses and star formation histories of phase-mixed stars
accreted at early times, as well as stars in surviving tidal debris features,
M31's extended disk, and intact satellite galaxies that will eventually be
tidally incorporated into the halo. This will yield an unprecedented view of
the hierarchical formation of the M31 system and the subhalos that built it
into the L* galaxy we observe today.
","[{'version': 'v1', 'created': 'Mon, 1 Apr 2019 19:27:22 GMT'}]",2019-04-03,"[['Gilbert', 'Karoline M.', ''], ['Tollerud', 'Erik J.', ''], ['Anderson', 'Jay', ''], ['Beaton', 'Rachael L.', ''], ['Bell', 'Eric F.', ''], ['Brooks', 'Alyson', ''], ['Brown', 'Thomas M.', ''], ['Bullock', 'James', ''], ['Carlin', 'Jeffrey L.', ''], ['Collins', 'Michelle', ''], ['Cooper', 'Andrew', ''], ['Crnojevic', 'Denija', ''], ['Dalcanton', 'Julianne', ''], ['del Pino', 'Andres', ''], [""D'Souza"", 'Richard', ''], ['Escala', 'Ivanna', ''], ['Fardal', 'Mark', ''], ['Font', 'Andreea', ''], ['Geha', 'Marla', ''], ['Guhathakurta', 'Puragra', ''], ['Kirby', 'Evan', ''], ['Lewis', 'Geraint F.', ''], ['Marshall', 'Jennifer L.', ''], ['Martin', 'Nicolas F.', ''], ['McQuinn', 'Kristen', ''], ['Monachesi', 'Antonela', ''], ['Patel', 'Ekta', ''], ['Peeples', 'Molly S.', ''], ['Pillepich', 'Annalisa', ''], ['Quirk', 'Amanda C. N.', ''], ['Rich', 'R. Michael', ''], ['Sohn', 'S. Tony', ''], ['Ting', 'Yuan-Sen', ''], ['van der Marel', 'Roeland P.', ''], ['Wetzel', 'Andrew', ''], ['Williams', 'Benjamin F.', ''], ['Wojno', 'Jennifer', '']]"
1904.02159,Harshil Kamdar,"Harshil Kamdar, Charlie Conroy, Yuan-Sen Ting, Ana Bonaca, Martin
  Smith, Anthony G.A. Brown",Stars that Move Together Were Born Together,"6 pages, 4 figures, 1 table. Submitted to ApJL. Catalog here:
  http://harshilkamdar.github.io/2019/04/03/pairs.html",,10.3847/2041-8213/ab4997,,astro-ph.GA astro-ph.SR,http://arxiv.org/licenses/nonexclusive-distrib/1.0/,"  It is challenging to reliably identify stars that were born together outside
of actively star-forming regions and bound stellar systems. However, co-natal
stars should be present throughout the Galaxy, and their demographics can shed
light on the clustered nature of star formation and the dynamical state of the
disk. In previous work we presented a set of simulations of the Galactic disk
that followed the clustered formation and dynamical evolution of 4 billion
individual stars over the last 5 Gyr. The simulations predict that a high
fraction of co-moving stars with physical and 3D velocity separation of $\Delta
r < 20$ pc and $\Delta v < 1.5$ km s$^{-1}$ are co-natal. In this
\textit{Letter}, we use \textit{Gaia} DR2 and LAMOST DR4 data to identify and
study co-moving pairs. We find that the distribution of relative velocities and
separations of pairs in the data is in good agreement with the predictions from
the simulation. We identify 111 co-moving pairs in the Solar neighborhood with
reliable astrometric and spectroscopic measurements. These pairs show a strong
preference for having similar metallicities when compared to random field
pairs. We therefore conclude that these pairs were very likely born together.
The simulations predict that co-natal pairs originate preferentially from
high-mass and relatively young ($< 1$ Gyr) star clusters. \textit{Gaia} will
eventually deliver well-determined metallicities for the brightest stars,
enabling the identification of thousands of co-natal pairs due to disrupting
star clusters in the solar neighborhood.
","[{'version': 'v1', 'created': 'Wed, 3 Apr 2019 18:00:00 GMT'}]",2019-11-06,"[['Kamdar', 'Harshil', ''], ['Conroy', 'Charlie', ''], ['Ting', 'Yuan-Sen', ''], ['Bonaca', 'Ana', ''], ['Smith', 'Martin', ''], ['Brown', 'Anthony G. A.', '']]"
