id,submitter,authors,title,comments,journal-ref,doi,report-no,categories,license,abstract,versions,update_date,authors_parsed
2103.03251,Rohan Naidu,"Rohan P. Naidu, Charlie Conroy, Ana Bonaca, Dennis Zaritsky, Rainer
  Weinberger, Yuan-Sen Ting, Nelson Caldwell, Sandro Tacchella, Jiwon Jesse
  Han, Joshua S. Speagle, Phillip A. Cargile",Reconstructing the Last Major Merger of the Milky Way with the H3 Survey,"Submitted to ApJ. See https://rohannaidu.github.io/moviesdata/ for
  merger movies. The simulation data is publicly available at
  https://dataverse.harvard.edu/dataset.xhtml?persistentId=doi:10.7910/DVN/UFVSTH
  . Comments greatly appreciated and very welcome! v2 fixes typos and adds
  references",,10.3847/1538-4357/ac2d2d,,astro-ph.GA,http://creativecommons.org/licenses/by/4.0/,"  Several lines of evidence suggest the Milky Way underwent a major merger at
z~2 with a galaxy known as Gaia-Sausage-Enceladus (GSE). Here we use H3 Survey
data to argue that GSE entered the Galaxy on a retrograde orbit based on a
population of highly retrograde stars with chemistry similar to the largely
radial GSE debris. We present the first tailored, high-resolution N-body
simulations of the merger. From a grid of ~500 simulations we find a GSE with
$M_{*}=5\times10^{8}\ M_{\odot}, M_{\rm{DM}}=2\times10^{11} M_{\odot}$ (a 2.5:1
total mass merger) best matches the H3 data. This simulation shows the
retrograde GSE stars are stripped from its outer disk early in the merger
before the orbit loses significant angular momentum. Despite being selected
purely on angular momenta and radial distributions, this simulation reproduces
and explains the following empirical phenomena: (i) the elongated, triaxial
shape of the inner halo (axis ratios $10:7.9:4.5$), whose major axis is at
~35{\deg} to the plane and connects GSE's apocenters, (ii) the Hercules-Aquila
Cloud & the Virgo Overdensity, which arise due to apocenter pile-up, (iii) the
2 Gyr lag between the quenching of GSE and the truncation of the age
distribution of the in-situ halo, which tracks the 2 Gyr gap between the first
and final GSE pericenters. We make the following predictions: (i) the inner
halo has a ""double-break"" density profile with breaks at both ~15-18 kpc and 30
kpc, coincident with the GSE apocenters, (ii) the outer halo has retrograde
streams containing ~10% of GSE stars awaiting discovery at >30 kpc. The
retrograde (radial) GSE debris originates from its outer (inner) disk --
exploiting this trend we reconstruct the stellar metallicity gradient of GSE
($-0.04\pm0.01$ dex $r_{\rm{50}}^{-1}$). These simulations imply GSE delivered
~20% of the Milky Way's present-day dark matter and ~50% of its stellar halo.
(ABRIDGED)
","[{'version': 'v1', 'created': 'Thu, 4 Mar 2021 19:00:00 GMT'}, {'version': 'v2', 'created': 'Wed, 17 Mar 2021 14:24:00 GMT'}]",2021-12-22,"[['Naidu', 'Rohan P.', ''], ['Conroy', 'Charlie', ''], ['Bonaca', 'Ana', ''], ['Zaritsky', 'Dennis', ''], ['Weinberger', 'Rainer', ''], ['Ting', 'Yuan-Sen', ''], ['Caldwell', 'Nelson', ''], ['Tacchella', 'Sandro', ''], ['Han', 'Jiwon Jesse', ''], ['Speagle', 'Joshua S.', ''], ['Cargile', 'Phillip A.', '']]"
2104.08684,Daniel Zucker,"Daniel B. Zucker, Jeffrey D. Simpson, Sarah L. Martell, Geraint F.
  Lewis, Andrew R. Casey, Yuan-Sen Ting, Jonathan Horner, Thomas Nordlander,
  Rosemary F. G. Wyse, Tomaz Zwitter, Joss Bland-Hawthorn, Sven Buder, Martin
  Asplund, Gayandhi M. De Silva, Valentina D'Orazi, Ken C. Freeman, Michael R.
  Hayden, Janez Kos, Jane Lin, Karin Lind, Katharine J. Schlesinger, Sanjib
  Sharma and Dennis Stello","The GALAH Survey: No chemical evidence of an extragalactic origin for
  the Nyx stream",Accepted for publication by ApJ Letters,,10.3847/2041-8213/abf7cd,,astro-ph.GA,http://creativecommons.org/licenses/by/4.0/,"  The results from the ESA Gaia astrometric mission and deep photometric
surveys have revolutionized our knowledge of the Milky Way. There are many
ongoing efforts to search these data for stellar substructure to find evidence
of individual accretion events that built up the Milky Way and its halo. One of
these newly identified features, called Nyx, was announced as an accreted
stellar stream traveling in the plane of the disk. Using a combination of
elemental abundances and stellar parameters from the GALAH and APOGEE surveys,
we find that the abundances of the highest likelihood Nyx members are entirely
consistent with membership of the thick disk, and inconsistent with a dwarf
galaxy origin. We conclude that the postulated Nyx stream is most probably a
high-velocity component of the Milky Way's thick disk. With the growing
availability of large data sets including kinematics, stellar parameters, and
detailed abundances, the probability of detecting chance associations
increases, and hence new searches for substructure require confirmation across
as many data dimensions as possible.
","[{'version': 'v1', 'created': 'Sun, 18 Apr 2021 02:34:49 GMT'}]",2021-05-19,"[['Zucker', 'Daniel B.', ''], ['Simpson', 'Jeffrey D.', ''], ['Martell', 'Sarah L.', ''], ['Lewis', 'Geraint F.', ''], ['Casey', 'Andrew R.', ''], ['Ting', 'Yuan-Sen', ''], ['Horner', 'Jonathan', ''], ['Nordlander', 'Thomas', ''], ['Wyse', 'Rosemary F. G.', ''], ['Zwitter', 'Tomaz', ''], ['Bland-Hawthorn', 'Joss', ''], ['Buder', 'Sven', ''], ['Asplund', 'Martin', ''], ['De Silva', 'Gayandhi M.', ''], [""D'Orazi"", 'Valentina', ''], ['Freeman', 'Ken C.', ''], ['Hayden', 'Michael R.', ''], ['Kos', 'Janez', ''], ['Lin', 'Jane', ''], ['Lind', 'Karin', ''], ['Schlesinger', 'Katharine J.', ''], ['Sharma', 'Sanjib', ''], ['Stello', 'Dennis', '']]"
2104.12883,Tyler Nelson,"Tyler Nelson, Yuan-Sen Ting, Keith Hawkins, Alexander Ji, Harshil
  Kamdar, Kareem El-Badry","Distant Relatives: The Chemical Homogeneity of Comoving Pairs Identified
  in Gaia","16 pages, 8 figures, submitted to ApJ",,10.3847/1538-4357/ac14be,,astro-ph.SR astro-ph.GA,http://creativecommons.org/licenses/by/4.0/,"  Comoving pairs, even at the separations of $\mathcal{O}(10^6)\,$AU, are a
predicted reservoir of conatal stars. We present detailed chemical abundances
of 62 stars in 31 comoving pairs with separations of $10^2 - 10^7\,$AU and 3D
velocity differences $< 2 \mathrm{\ km \ s^{-1}}$. This sample includes both
bound comoving pairs/wide binaries and unbound comoving pairs. Observations
were taken using the MIKE spectrograph on the Magellan/Clay Telescope at high
resolution ($\mathrm{R} \sim 45,000$) with a typical signal-to-noise ratio of
150 per pixel. With these spectra, we measure surface abundances for 24
elements, including Li, C, Na, Mg, Al, Si, Ca, Sc, Ti, V, Cr, Mn, Fe, Co, Ni,
Cu, Zn, Sr, Y, Zr, Ba, La, Nd, Eu. Taking iron as the representative element,
our sample of wide binaries is chemically homogeneous at the level of $0.05$
dex, which agrees with prior studies on wide binaries. Importantly, even
systems at separations $2\times10^5-10^7\,$AU are homogeneous to $0.09$ dex, as
opposed to the random pairs which have a dispersion of $0.23\,$dex. Assuming a
mixture model of the wide binaries and random pairs, we find that $73 \pm 22\%$
of the comoving pairs at separations $2\times10^5-10^7\,$AU are conatal. Our
results imply that a much larger parameter space of phase space may be used to
find conatal stars, to study M-dwarfs, star cluster evolution, exoplanets,
chemical tagging, and beyond.
","[{'version': 'v1', 'created': 'Mon, 26 Apr 2021 21:21:06 GMT'}, {'version': 'v2', 'created': 'Tue, 15 Jun 2021 16:24:07 GMT'}]",2021-11-17,"[['Nelson', 'Tyler', ''], ['Ting', 'Yuan-Sen', ''], ['Hawkins', 'Keith', ''], ['Ji', 'Alexander', ''], ['Kamdar', 'Harshil', ''], ['El-Badry', 'Kareem', '']]"
2105.04581,Jenny Greene,"Jenny E. Greene, Lachlan Lancaster, Yuan-Sen Ting, Sergey E. Koposov,
  Shany Danieli, Song Huang, Fangzhou Jiang, Johnny P. Greco, Jay Strader",A Search for Wandering Black Holes in the Milky Way with Gaia and DECaLS,"20 pages, 8 figures, under review at ApJ",,10.3847/1538-4357/ac0896,,astro-ph.GA,http://arxiv.org/licenses/nonexclusive-distrib/1.0/,"  We present a search for ""hyper-compact"" star clusters in the Milky Way using
a combination of Gaia and the Dark Energy Camera Legacy Survey (DECaLS). Such
putative clusters, with sizes of ~1 pc and containing 500-5000 stars, are
expected to remain bound to intermediate-mass black holes (Mbh~10^3-10^5 M-sun)
that may be accreted into the Milky Way halo within dwarf satellites. Using the
semi-analytic model SatGen we find an expected ~100 wandering intermediate-mass
black holes with if every infalling satellite hosts a black hole. We do not
find any such clusters in our search. Our upper limits rule out 100% occupancy,
but do not put stringent constraints on the occupation fraction. Of course, we
need stronger constraints on the properties of the putative star clusters,
including their assumed sizes as well as the fraction of stars that would be
compact remnants.
","[{'version': 'v1', 'created': 'Mon, 10 May 2021 18:00:15 GMT'}]",2021-08-18,"[['Greene', 'Jenny E.', ''], ['Lancaster', 'Lachlan', ''], ['Ting', 'Yuan-Sen', ''], ['Koposov', 'Sergey E.', ''], ['Danieli', 'Shany', ''], ['Huang', 'Song', ''], ['Jiang', 'Fangzhou', ''], ['Greco', 'Johnny P.', ''], ['Strader', 'Jay', '']]"
2106.02050,Harshil Kamdar,"Harshil Kamdar, Charlie Conroy, Yuan-Sen Ting","Stellar Streams in the Galactic Disk: Predicted Lifetimes and Their
  Utility in Measuring the Galactic Potential","13 pages, 10 figures. Submitted to ApJ -- comments welcome",,,,astro-ph.GA,http://creativecommons.org/licenses/by/4.0/,"  In this paper, we present a holistic view of the detection, characterization,
and origin of stellar streams in the disk of a simulated Milky Way-like galaxy.
The star-by-star simulation of the Galaxy evolves stars born in clusters in a
realistic galactic potential that includes spiral arms, a bar, and giant
molecular clouds over $5$ Gyr. We first devise a new hybrid method to detect
stellar streams that combines phase space density information along with the
action-angle space spanned by stars in our simulation. We find that streams'
progenitor star clusters and associations are all preferentially higher-mass
($>1000$ $M_{\odot}$) and young ($< 1$ Gyr). Our stream-finding method predicts
that we might be able to find anywhere from $1$ to $10$ streams with 6D
\textit{Gaia} DR2 data in the solar neighborhood alone. The simulation suggests
that streams are sensitive to the initial dynamical state of clusters,
accumulated energy gain from encounters with giant molecular clouds (GMCs), and
present-day actions. We investigate what we can learn about the Galactic
potential by studying the feasiblity of rewinding stellar streams back to their
origin. Even with perfect information about the non-axisymmetric components
(spiral arms, bar) of the galactic potential, the stochastic GMC population
makes backwards integration impossible beyond one or two disk orbital times.
Streams are also sensitive to the properties of the bar, but fairly insensitive
to the properties of the non-transient two-armed spiral in our simulation.
Finally we predict that around $10$ to $30$ stellar streams should be
detectable with \textit{Gaia}'s 10-year end-of-mission data. There are many
more stellar streams waiting to be discovered in the Galactic disk, and they
could hold clues about the history of the Galaxy for the past Gyr.
","[{'version': 'v1', 'created': 'Thu, 3 Jun 2021 18:00:03 GMT'}]",2021-06-07,"[['Kamdar', 'Harshil', ''], ['Conroy', 'Charlie', ''], ['Ting', 'Yuan-Sen', '']]"
2108.02878,Maosheng Xiang,"Maosheng Xiang, Hans-Walter Rix, Yuan-Sen Ting, Rolf-Peter Kudritzki,
  Charlie Conroy, Eleonora Zari, Jian-Rong Shi, Norbert Przybilla, Maria
  Ramirez-Tannus, Andrew Tkachenko, Sarah Gebruers, Xiao-Wei Liu","Stellar labels for hot stars from low-resolution spectra - I. the
  HotPayne method and results for 330,000 stars from LAMOST DR6","30 pages, 22 figures, submitted to Astronomy & Astrophysics, comments
  are welcome","A&A 662, A66 (2022)",10.1051/0004-6361/202141570,,astro-ph.SR,http://arxiv.org/licenses/nonexclusive-distrib/1.0/,"  We set out to determine stellar labels from low-resolution survey spectra of
hot, OBA stars with effective temperature (Teff) higher than 7500K. This fills
a gap in the scientific analysis of large spectroscopic stellar surveys such as
LAMOST, which offers spectra for millions of stars at R=1800. We first explore
the theoretical information content of such spectra for determining stellar
labels, via the Cram\'er-Rao bound. We show that in the limit of perfect model
spectra and observed spectra with S/N of 100, precise estimates are possible
for a wide range of stellar labels: not only the effective temperature Teff,
surface gravity logg, and projected rotation velocity vsini, but also the
micro-turbulence velocity, Helium abundance and the elemental abundances [C/H],
[N/H], [O/H], [Si/H], [S/H], and [Fe/H]. Our analysis illustrates that the
temperature regime of around 9500K is challenging, as the dominant Balmer and
Paschen line strength vary little with Teff. We implement the simultaneous
fitting of these 11 stellar labels to LAMOST hot-star spectra using the Payne
approach, drawing on Kurucz's ATLAS12/SYNTHE LTE spectra as the underlying
models. We then obtain stellar parameter estimates for a sample of about
330,000 hot stars with LAMOST spectra, an increase by about two orders of
magnitude in sample size. Among them, about 260,000 have good Gaia parallaxes
(S/N>5), and more than 95 percent of them are luminous stars, mostly on the
main sequence; the rest reflects lower luminosity evolved stars, such as hot
subdwarfs and white dwarfs. We show that the fidelity of the abundance
estimates is limited by the systematics of the underlying models, as they do
not account for NLTE effects. Finally, we show the detailed distribution of
vsini of stars with 8000-15,000K, illustrating that it extends to a sharp
cut-off at the critical rotation velocity, across a wide range of temperatures.
","[{'version': 'v1', 'created': 'Thu, 5 Aug 2021 22:51:17 GMT'}]",2022-06-22,"[['Xiang', 'Maosheng', ''], ['Rix', 'Hans-Walter', ''], ['Ting', 'Yuan-Sen', ''], ['Kudritzki', 'Rolf-Peter', ''], ['Conroy', 'Charlie', ''], ['Zari', 'Eleonora', ''], ['Shi', 'Jian-Rong', ''], ['Przybilla', 'Norbert', ''], ['Ramirez-Tannus', 'Maria', ''], ['Tkachenko', 'Andrew', ''], ['Gebruers', 'Sarah', ''], ['Liu', 'Xiao-Wei', '']]"
2108.08860,David H. Weinberg,"David H. Weinberg, Jon A. Holtzman, Jennifer A. Johnson, Christian
  Hayes, Sten Hasselquist, Matthew Shetrone, Yuan-Sen Ting, Rachael L. Beaton,
  Timothy C. Beers, Jonathan C. Bird, Dmitry Bizyaev, Michael R. Blanton, Katia
  Cunha, Jose G. Fernandez-Trincado, Peter M. Frinchaboy, D. A.
  Garcia-Hernandez, Emily Griffith, James W. Johnson, Henrik Jonsson, Richard
  R. Lane, Henry W. Leung, J. Ted Mackereth, Steven R. Majewski, Szabolcz
  Meszaros, Christian Nitschelm, Kaike Pan, Ricardo P. Schiavon, Donald P.
  Schneider, Mathias Schultheis, Verne Smith, Jennifer S. Sobeck, Keivan G.
  Stassun, Guy S. Stringfellow, Fiorenzo Vincenzo, John C. Wilson, Gail
  Zasowski","Chemical Cartography with APOGEE: Mapping Disk Populations with a
  Two-Process Model and Residual Abundances","Submitted to AAS journals. Long paper, many figures; see end of
  Section 1 for a reader's guide",,10.3847/1538-4365/ac6028,,astro-ph.GA,http://creativecommons.org/licenses/by/4.0/,"  We apply a novel statistical analysis to measurements of 16 elemental
abundances in 34,410 Milky Way disk stars from the final data release (DR17) of
APOGEE-2. Building on recent work, we fit median abundance ratio trends [X/Mg]
vs. [Mg/H] with a 2-process model, which decomposes abundance patterns into a
""prompt"" component tracing core collapse supernovae and a ""delayed"" component
tracing Type Ia supernovae. For each sample star, we fit the amplitudes of
these two components, then compute the residuals \Delta[X/H] from this
two-parameter fit. The rms residuals range from ~0.01-0.03 dex for the most
precisely measured APOGEE abundances to ~0.1 dex for Na, V, and Ce. The
correlations of residuals reveal a complex underlying structure, including a
correlated element group comprised of Ca, Na, Al, K, Cr, and Ce and a separate
group comprised of Ni, V, Mn, and Co. Selecting stars poorly fit by the
2-process model reveals a rich variety of physical outliers and sometimes
subtle measurement errors. Residual abundances allow comparison of populations
controlled for differences in metallicity and [\alpha/Fe]. Relative to the main
disk (R=3-13 kpc, |Z|<2 kpc), we find nearly identical abundance patterns in
the outer disk (R=15-17 kpc), 0.05-0.2 dex depressions of multiple elements in
LMC and Gaia Sausage/Enceladus stars, and wild deviations (0.4-1 dex) of
multiple elements in \omega Cen. Residual abundance analysis opens new
opportunities for discovering chemically distinctive stars and stellar
populations, for empirically constraining nucleosynthetic yields, and for
testing chemical evolution models that include stochasticity in the production
and redistribution of elements.
","[{'version': 'v1', 'created': 'Thu, 19 Aug 2021 18:01:01 GMT'}]",2022-06-29,"[['Weinberg', 'David H.', ''], ['Holtzman', 'Jon A.', ''], ['Johnson', 'Jennifer A.', ''], ['Hayes', 'Christian', ''], ['Hasselquist', 'Sten', ''], ['Shetrone', 'Matthew', ''], ['Ting', 'Yuan-Sen', ''], ['Beaton', 'Rachael L.', ''], ['Beers', 'Timothy C.', ''], ['Bird', 'Jonathan C.', ''], ['Bizyaev', 'Dmitry', ''], ['Blanton', 'Michael R.', ''], ['Cunha', 'Katia', ''], ['Fernandez-Trincado', 'Jose G.', ''], ['Frinchaboy', 'Peter M.', ''], ['Garcia-Hernandez', 'D. A.', ''], ['Griffith', 'Emily', ''], ['Johnson', 'James W.', ''], ['Jonsson', 'Henrik', ''], ['Lane', 'Richard R.', ''], ['Leung', 'Henry W.', ''], ['Mackereth', 'J. Ted', ''], ['Majewski', 'Steven R.', ''], ['Meszaros', 'Szabolcz', ''], ['Nitschelm', 'Christian', ''], ['Pan', 'Kaike', ''], ['Schiavon', 'Ricardo P.', ''], ['Schneider', 'Donald P.', ''], ['Schultheis', 'Mathias', ''], ['Smith', 'Verne', ''], ['Sobeck', 'Jennifer S.', ''], ['Stassun', 'Keivan G.', ''], ['Stringfellow', 'Guy S.', ''], ['Vincenzo', 'Fiorenzo', ''], ['Wilson', 'John C.', ''], ['Zasowski', 'Gail', '']]"
2108.11001,Fan Liu,"Fan Liu, Bertram Bitsch, Martin Asplund, Bei-Bei Liu, Michael T.
  Murphy, David Yong, Yuan-Sen Ting and Sofia Feltzing","Detailed elemental abundances of binary stars: Searching for signatures
  of planet formation and atomic diffusion","15 pages, 16 figures; accepted by MNRAS",,10.1093/mnras/stab2471,,astro-ph.SR astro-ph.EP,http://arxiv.org/licenses/nonexclusive-distrib/1.0/,"  Binary star systems are assumed to be co-natal and coeval, thus to have
identical chemical composition. In this work we aim to test the hypothesis that
there is a connection between observed element abundance patterns and the
formation of planets using binary stars. Moreover, we also want to test how
atomic diffusion might influence the observed abundance patterns. We conduct a
strictly line-by-line differential chemical abundance analysis of 7 binary
systems. Stellar atmospheric parameters and elemental abundances are obtained
with extremely high precision (< 3.5%) using the high quality spectra from
VLT/UVES and Keck/HIRES. We find that 4 of 7 binary systems show subtle
abundance differences (0.01 - 0.03 dex) without clear correlations with the
condensation temperature, including two planet-hosting pairs. The other 3
binary systems exhibit similar degree of abundance differences correlating with
the condensation temperature. We do not find any clear relation between the
abundance differences and the occurrence of known planets in our systems.
Instead, the overall abundance offsets observed in the binary systems (4 of 7)
could be due to the effects of atomic diffusion. Although giant planet
formation does not necessarily imprint chemical signatures onto the host star,
the differences in the observed abundance trends with condensation temperature,
on the other hand, are likely associated with diverse histories of planet
formation (e.g., formation location). Furthermore, we find a weak correlation
between abundance differences and binary separation, which may provide a new
constraint on the formation of binary systems.
","[{'version': 'v1', 'created': 'Wed, 25 Aug 2021 00:50:25 GMT'}]",2021-09-06,"[['Liu', 'Fan', ''], ['Bitsch', 'Bertram', ''], ['Asplund', 'Martin', ''], ['Liu', 'Bei-Bei', ''], ['Murphy', 'Michael T.', ''], ['Yong', 'David', ''], ['Ting', 'Yuan-Sen', ''], ['Feltzing', 'Sofia', '']]"
2109.00746,Meng Zhang,"Meng Zhang, Mao-Sheng Xiang, Hua-Wei Zhang, Yuan-Sen Ting, Hans-Walter
  Rix, Ya-qian Wu, Yang Huang, Wei-Xiang Sun, Zhi-Jia Tian, Chun Wang, Xiao-Wei
  Liu","Most ""young"" $\alpha$-rich stars have high masses but are actually old","17 pages, 14 figures, 2 tables, accepted for publication in ApJ",,10.3847/1538-4357/ac22a5,,astro-ph.GA astro-ph.SR,http://arxiv.org/licenses/nonexclusive-distrib/1.0/,"  Recent observations have revealed a population of $\alpha$-element abundances
enhanced giant stars with unexpected high masses ($\gtrsim$1 $M_\odot$) from
asteroseismic analysis and spectroscopy. Assuming single-star evolution, their
masses imply young ages ($\tau<6$Gyr) incompatible with the canonical Galactic
chemical evolution scenario. Here we study the chemistry and kinematics of a
large sample of such $\alpha$-rich, high-mass red giant branch (RGB) stars
drawn from the LAMOST spectroscopic surveys. Using LAMOST and Gaia, we found
these stars share the same kinematics as the canonical high-$\alpha$ old
stellar population in the Galactic thick disk. The stellar abundances show that
these high-$\alpha$ massive stars have $\alpha$- and iron-peak element
abundances similar to those of the high-$\alpha$ old thick disk stars. However,
a portion of them exhibit higher [(N+C)/Fe] and [Ba/Fe] ratios, which implies
they have gained C- and Ba-rich materials from extra sources, presumably
asymptotic giant branch (AGB) companions. The results support the previous
suggestion that these RGB stars are products of binary evolution. Their high
masses thus mimic ""young"" single stars, yet in fact they belong to an intrinsic
old stellar population. To fully explain the stellar abundance patterns of our
sample stars, a variety of binary evolution channels, such as, main-sequence
(MS) + RGB, MS + AGB, RGB + RGB and RGB + AGB, are required, pointing to
diverse formation mechanisms of these seemly rejuvenated cannibals. With this
larger sample, our results confirm earlier findings that most, if not all,
$\alpha$-rich stars in the Galactic disk seem to be old.
","[{'version': 'v1', 'created': 'Thu, 2 Sep 2021 07:02:02 GMT'}]",2021-12-08,"[['Zhang', 'Meng', ''], ['Xiang', 'Mao-Sheng', ''], ['Zhang', 'Hua-Wei', ''], ['Ting', 'Yuan-Sen', ''], ['Rix', 'Hans-Walter', ''], ['Wu', 'Ya-qian', ''], ['Huang', 'Yang', ''], ['Sun', 'Wei-Xiang', ''], ['Tian', 'Zhi-Jia', ''], ['Wang', 'Chun', ''], ['Liu', 'Xiao-Wei', '']]"
